{
  "$schema": "https://json-schema.org/draft/2020-12/schema",
  "title": "Codex Harness Run Manifest",
  "description": "Aggregate run manifest for runner, wrapper, and hook observations. This is not a replacement for codex-task report JSON. Failure interpretation remains canonical in evaluation.json.",
  "type": "object",
  "additionalProperties": false,
  "required": [
    "schema_version",
    "run_id",
    "task_type",
    "workflow_level",
    "preset",
    "runtime",
    "agents_used",
    "repo",
    "branch",
    "base_branch",
    "codex_task_reports",
    "changed_files",
    "validation",
    "safety",
    "evaluation_path",
    "status",
    "primary_failure_category"
  ],
  "properties": {
    "schema_version": {
      "type": "integer",
      "enum": [
        1
      ],
      "description": "Schema version for the run manifest."
    },
    "run_id": {
      "type": "string",
      "minLength": 1,
      "description": "Run identifier for the aggregate manifest."
    },
    "task_type": {
      "type": "string",
      "enum": [
        "plan",
        "review",
        "implementation",
        "investigation",
        "repair",
        "harness-improvement"
      ],
      "description": "High-level task classification for the run."
    },
    "workflow_level": {
      "type": "string",
      "enum": [
        "lightweight",
        "standard",
        "strict"
      ],
      "description": "Workflow rigor level selected for the run."
    },
    "preset": {
      "type": "string",
      "enum": [
        "safe",
        "readonly",
        "auto-net"
      ],
      "description": "Wrapper preset used for the run."
    },
    "runtime": {
      "type": "string",
      "enum": [
        "host",
        "docker-sandbox",
        "sdk"
      ],
      "description": "Runtime used for the run. The sdk value is reserved for future experimental work and does not imply an SDK runner exists in this implementation."
    },
    "agents_used": {
      "type": "array",
      "description": "Agents that participated in the run.",
      "items": {
        "type": "string",
        "minLength": 1
      }
    },
    "repo": {
      "type": [
        "string",
        "null"
      ],
      "description": "Repository identifier if known."
    },
    "branch": {
      "type": [
        "string",
        "null"
      ],
      "description": "Working branch observed by the runner or wrapper."
    },
    "base_branch": {
      "type": [
        "string",
        "null"
      ],
      "description": "Base branch observed or configured for the run."
    },
    "codex_task_reports": {
      "type": "array",
      "description": "Paths to low-level codex-task report JSON artifacts referenced by this run manifest.",
      "items": {
        "type": "string",
        "minLength": 1
      }
    },
    "changed_files": {
      "type": "array",
      "description": "Observed changed files for the run. Agents do not hand-write this field.",
      "items": {
        "type": "string",
        "minLength": 1
      }
    },
    "validation": {
      "type": "object",
      "additionalProperties": false,
      "required": [
        "status",
        "commands"
      ],
      "properties": {
        "status": {
          "type": "string",
          "enum": [
            "not_run",
            "passed",
            "passed_with_warnings",
            "failed",
            "skipped",
            "blocked"
          ],
          "description": "Aggregate validation status for the run."
        },
        "commands": {
          "type": "array",
          "description": "Observed validation command records. These are runner, wrapper, or hook observations rather than agent-authored interpretation.",
          "items": {
            "type": "object",
            "additionalProperties": false,
            "required": [
              "command",
              "exit_code",
              "status",
              "evidence"
            ],
            "properties": {
              "command": {
                "type": "string",
                "minLength": 1
              },
              "exit_code": {
                "type": [
                  "integer",
                  "null"
                ]
              },
              "status": {
                "type": "string",
                "enum": [
                  "not_run",
                  "passed",
                  "failed",
                  "skipped",
                  "blocked"
                ]
              },
              "evidence": {
                "type": "string",
                "minLength": 1
              }
            }
          }
        },
        "warnings": {
          "type": "array",
          "description": "Non-fatal validation warnings observed during the run.",
          "items": {
            "type": "object",
            "additionalProperties": false,
            "required": [
              "type",
              "path"
            ],
            "properties": {
              "type": {
                "type": "string",
                "minLength": 1
              },
              "path": {
                "type": "string",
                "minLength": 1
              },
              "message": {
                "type": [
                  "string",
                  "null"
                ]
              }
            }
          }
        }
      }
    },
    "safety": {
      "type": "object",
      "additionalProperties": false,
      "required": [
        "network",
        "delete_attempt_blocked",
        "git_mutation_attempt_blocked",
        "scope_violation"
      ],
      "properties": {
        "network": {
          "type": "boolean",
          "description": "Whether network access was enabled or observed for the run."
        },
        "delete_attempt_blocked": {
          "type": "boolean",
          "description": "Whether a delete attempt was blocked by wrapper, rules, or hooks."
        },
        "git_mutation_attempt_blocked": {
          "type": "boolean",
          "description": "Whether a git mutation attempt was blocked by wrapper, rules, or hooks."
        },
        "scope_violation": {
          "type": "boolean",
          "description": "Whether scope-violation evidence was observed for the run."
        }
      }
    },
    "evaluation_path": {
      "type": [
        "string",
        "null"
      ],
      "description": "Path to the evaluation.json artifact used as the source of truth for failure interpretation."
    },
    "status": {
      "type": "string",
      "enum": [
        "pending",
        "running",
        "completed",
        "failed",
        "cancelled"
      ],
      "description": "Runner lifecycle status. completed means artifact generation finished; it does not imply task success."
    },
    "primary_failure_category": {
      "enum": [
        null,
        "instruction_gap",
        "scope_creep",
        "missing_context",
        "missing_validation",
        "unsafe_action_blocked",
        "bad_subagent_delegation",
        "flaky_or_env_issue",
        "review_gap",
        "repair_loop_stalled",
        "artifact_contract_gap"
      ],
      "description": "Copied summary field from evaluation.json.primary_failure_category. Before evaluation.json exists, this should remain null."
    },
    "artifact_summary": {
      "type": "object",
      "additionalProperties": false,
      "required": [
        "codex_task_report_count",
        "hook_event_count",
        "subagent_run_count",
        "evaluation_present"
      ],
      "properties": {
        "codex_task_report_count": {
          "type": "integer",
          "minimum": 0
        },
        "hook_event_count": {
          "type": "integer",
          "minimum": 0
        },
        "subagent_run_count": {
          "type": "integer",
          "minimum": 0
        },
        "evaluation_present": {
          "type": "boolean"
        }
      }
    },
    "hook_observations": {
      "type": "object",
      "additionalProperties": false,
      "required": [
        "log_paths",
        "event_counts",
        "blocking_event_count",
        "safety_blocked_count",
        "observation_error_count"
      ],
      "properties": {
        "log_paths": {
          "type": "array",
          "items": {
            "type": "string",
            "minLength": 1
          }
        },
        "event_counts": {
          "type": "object",
          "additionalProperties": {
            "type": "integer",
            "minimum": 0
          }
        },
        "blocking_event_count": {
          "type": "integer",
          "minimum": 0
        },
        "safety_blocked_count": {
          "type": "integer",
          "minimum": 0
        },
        "observation_error_count": {
          "type": "integer",
          "minimum": 0
        }
      }
    },
    "subagents": {
      "type": "object",
      "additionalProperties": false,
      "required": [
        "records",
        "summary"
      ],
      "properties": {
        "records": {
          "type": "array",
          "items": {
            "type": "object",
            "additionalProperties": false,
            "required": [
              "path",
              "subagent_run_id",
              "agent_name",
              "role",
              "mode",
              "status",
              "allowed_files_count",
              "changed_files_count",
              "scope_compliant",
              "used_in_final_plan",
              "parent_decision"
            ],
            "properties": {
              "path": {
                "type": "string",
                "minLength": 1
              },
              "subagent_run_id": {
                "type": "string",
                "minLength": 1
              },
              "agent_name": {
                "type": [
                  "string",
                  "null"
                ],
                "minLength": 1
              },
              "role": {
                "type": "string",
                "minLength": 1
              },
              "mode": {
                "type": "string",
                "minLength": 1
              },
              "status": {
                "type": "string",
                "minLength": 1
              },
              "allowed_files_count": {
                "type": "integer",
                "minimum": 0
              },
              "changed_files_count": {
                "type": "integer",
                "minimum": 0
              },
              "scope_compliant": {
                "type": [
                  "boolean",
                  "null"
                ]
              },
              "used_in_final_plan": {
                "type": "boolean"
              },
              "parent_decision": {
                "type": [
                  "string",
                  "null"
                ],
                "minLength": 1
              }
            }
          }
        },
        "summary": {
          "type": "object",
          "additionalProperties": false,
          "required": [
            "total",
            "read_only",
            "writable",
            "scope_violations",
            "used_in_final_plan"
          ],
          "properties": {
            "total": {
              "type": "integer",
              "minimum": 0
            },
            "read_only": {
              "type": "integer",
              "minimum": 0
            },
            "writable": {
              "type": "integer",
              "minimum": 0
            },
            "scope_violations": {
              "type": "integer",
              "minimum": 0
            },
            "used_in_final_plan": {
              "type": "integer",
              "minimum": 0
            }
          }
        }
      }
    }
  }
}
